{
  "schema_version": "1.0",
  "content_version": "framework-taxonomy-preview-15",
  "entity": "perspective_theme",
  "status": "approved",
  "primary_theme": "emotion",
  "display_name_vi": "Cảm xúc",
  "description_vi": "Nhận biết, đón nhận và sống cùng cảm xúc mà không để cảm xúc định nghĩa toàn bộ mình.",
  "language": "vi",
  "quotes": [
    {
      "id": "attributed.ma.iv_07.suppress_injury",
      "revision": 2,
      "kind": "adapted_wisdom",
      "title_vi": null,
      "text_vi": "Buông ý nghĩ ấy, tiếng kêu “Tôi bị tổn thương” cũng biến mất. Buông tiếng kêu ấy, cảm giác về vết thương cũng đổi khác.",
      "subtitle_vi": null,
      "primary_theme": "emotion",
      "authorship": {
        "author_id": "marcus_aurelius",
        "author_name": "Marcus Aurelius",
        "work": "The Meditations of the Emperor Marcus Aurelius Antoninus",
        "source_url": "https://www.gutenberg.org/ebooks/55317",
        "source_language": "en",
        "source_label": "Marcus Aurelius · Suy tưởng",
        "source_detail": "George W. Chrystal (dịch), 1902; Quyển IV, đoạn 7; bản Việt là bản dịch nháp Selflo từ exact English source"
      },
      "metadata": {
        "concepts": [

        ],
        "theories": [

        ],
        "frameworks": [
          "framework.stoicism"
        ],
        "emotion_tags": [

        ],
        "keywords": [
          "judgment"
        ]
      },
      "rights": {
        "status": "public_domain",
        "note": "Tác phẩm và bản dịch nguồn được sử dụng là các văn bản cổ hoặc các ấn bản thuộc phạm vi công cộng. Nội dung tiếng Việt trong Selflo được dịch, diễn đạt hoặc biên soạn lại trực tiếp từ các nguồn đã dẫn để truyền tải trung thành ý nghĩa gốc; không sao chép từ các bản dịch tiếng Việt hiện đại có bản quyền."
      },
      "review": {
        "status": "approved",
        "reviewed_by": "owner:dungvo",
        "reviewed_at": "2026-09-13T01:41:15Z"
      },
      "writing": {
        "semantic_intent": "Buông ý nghĩ ấy, tiếng kêu “Tôi bị tổn thương” cũng biến mất. Buông tiếng kêu ấy, cảm giác về vết thương cũng đổi khác.",
        "observation_key": null,
        "structure_pattern": "attributed_quote"
      },
      "display": {
        "mode": "poster",
        "priority": 50,
        "featured": false,
        "style": "paper_quote",
        "attribution_vi": "Marcus Aurelius · Suy tưởng · Quyển IV, đoạn 7"
      },
      "story_id": null,
      "selection": {
        "source_type": "reflection",
        "reflection_kind": "quote",
        "thought_match_keys": [

        ],
        "presentation_tags": [
          "emotion",
          "judgment"
        ],
        "tie_break_order": 1126
      },
      "knowledge_basis": null
    },
    {
      "id": "attributed.ma.viii_47.judgment_afflicts",
      "revision": 2,
      "kind": "adapted_wisdom",
      "title_vi": null,
      "text_vi": "Khi buồn khổ vì một điều bên ngoài, không chỉ bản thân sự việc làm bạn đau, mà còn là phán đoán của bạn về nó. Và phán đoán ấy là phần bạn có thể xem xét lại.",
      "subtitle_vi": null,
      "primary_theme": "emotion",
      "authorship": {
        "author_id": "marcus_aurelius",
        "author_name": "Marcus Aurelius",
        "work": "The Meditations of the Emperor Marcus Aurelius Antoninus",
        "source_url": "https://www.gutenberg.org/ebooks/55317",
        "source_language": "en",
        "source_label": "Marcus Aurelius · Suy tưởng",
        "source_detail": "George W. Chrystal (dịch), 1902; Quyển VIII, đoạn 47; bản Việt là bản dịch nháp Selflo từ exact English source"
      },
      "metadata": {
        "concepts": [

        ],
        "theories": [

        ],
        "frameworks": [
          "framework.stoicism"
        ],
        "emotion_tags": [

        ],
        "keywords": [
          "judgment"
        ]
      },
      "rights": {
        "status": "public_domain",
        "note": "Tác phẩm và bản dịch nguồn được sử dụng là các văn bản cổ hoặc các ấn bản thuộc phạm vi công cộng. Nội dung tiếng Việt trong Selflo được dịch, diễn đạt hoặc biên soạn lại trực tiếp từ các nguồn đã dẫn để truyền tải trung thành ý nghĩa gốc; không sao chép từ các bản dịch tiếng Việt hiện đại có bản quyền."
      },
      "review": {
        "status": "approved",
        "reviewed_by": "owner:dungvo",
        "reviewed_at": "2026-09-13T01:41:15Z"
      },
      "writing": {
        "semantic_intent": "Khi buồn khổ vì một điều bên ngoài, không chỉ bản thân sự việc làm bạn đau, mà còn là phán đoán của bạn về nó. Và phán đoán ấy là phần bạn có thể xem xét lại.",
        "observation_key": null,
        "structure_pattern": "attributed_quote"
      },
      "display": {
        "mode": "poster",
        "priority": 50,
        "featured": false,
        "style": "paper_quote",
        "attribution_vi": "Marcus Aurelius · Suy tưởng · Quyển VIII, đoạn 47"
      },
      "story_id": null,
      "selection": {
        "source_type": "reflection",
        "reflection_kind": "quote",
        "thought_match_keys": [

        ],
        "presentation_tags": [
          "emotion",
          "judgment"
        ],
        "tie_break_order": 1162
      },
      "knowledge_basis": null
    },
    {
      "id": "attributed.epictetus.ench_05.opinion",
      "revision": 2,
      "kind": "adapted_wisdom",
      "title_vi": null,
      "text_vi": "Con người không chỉ bị xáo trộn bởi điều xảy ra, mà còn bởi ý kiến của họ về điều ấy.",
      "subtitle_vi": null,
      "primary_theme": "emotion",
      "authorship": {
        "author_id": "epictetus",
        "author_name": "Epictetus",
        "work": "A Selection from the Discourses of Epictetus with the Encheiridion",
        "source_url": "https://www.gutenberg.org/ebooks/10661",
        "source_language": "en",
        "source_label": "Epictetus · Encheiridion",
        "source_detail": "George Long (dịch); V; bản Việt là bản dịch nháp Selflo từ exact English source"
      },
      "metadata": {
        "concepts": [

        ],
        "theories": [

        ],
        "frameworks": [
          "framework.stoicism"
        ],
        "emotion_tags": [

        ],
        "keywords": [
          "stoicism",
          "judgment"
        ]
      },
      "rights": {
        "status": "public_domain",
        "note": "Tác phẩm nguồn là các văn bản cổ hoặc đã thuộc phạm vi công cộng. Phần diễn đạt câu trích dẫn bằng tiếng Việt và các câu chuyện trong Selflo được biên soạn hoặc kể lại mới dựa trên nguồn đã dẫn, không sao chép từ các bản dịch tiếng Việt hiện đại có bản quyền."
      },
      "review": {
        "status": "approved",
        "reviewed_by": "owner:dungvo",
        "reviewed_at": "2026-09-13T01:15:32Z"
      },
      "writing": {
        "semantic_intent": "Con người không chỉ bị xáo trộn bởi điều xảy ra, mà còn bởi ý kiến của họ về điều ấy.",
        "observation_key": null,
        "structure_pattern": "attributed_quote"
      },
      "display": {
        "mode": "poster",
        "priority": 50,
        "featured": false,
        "style": "paper_quote",
        "attribution_vi": "Epictetus · Encheiridion · V"
      },
      "story_id": "story.empty_boat_on_the_river",
      "selection": {
        "source_type": "reflection",
        "reflection_kind": "quote",
        "thought_match_keys": [

        ],
        "presentation_tags": [
          "emotion",
          "stoicism",
          "judgment"
        ],
        "tie_break_order": 5003
      },
      "knowledge_basis": null
    },
    {
      "id": "attributed.seneca.letter_13.imagination",
      "revision": 2,
      "kind": "adapted_wisdom",
      "title_vi": null,
      "text_vi": "Có nhiều điều làm ta sợ hơn là thật sự quật ngã ta; ta thường đau trong tưởng tượng nhiều hơn trong thực tế.",
      "subtitle_vi": null,
      "primary_theme": "emotion",
      "authorship": {
        "author_id": "seneca",
        "author_name": "Seneca",
        "work": "Moral Letters to Lucilius",
        "source_url": "https://en.wikisource.org/wiki/Moral_letters_to_Lucilius/Letter_13",
        "source_language": "en",
        "source_label": "Seneca · Thư gửi Lucilius",
        "source_detail": "Richard M. Gummere (dịch); 13; bản Việt là bản dịch nháp Selflo từ exact English source"
      },
      "metadata": {
        "concepts": [

        ],
        "theories": [

        ],
        "frameworks": [
          "framework.stoicism"
        ],
        "emotion_tags": [

        ],
        "keywords": [
          "stoicism",
          "future_fear"
        ]
      },
      "rights": {
        "status": "public_domain",
        "note": "Tác phẩm và bản dịch nguồn được sử dụng là các văn bản cổ hoặc các ấn bản thuộc phạm vi công cộng. Nội dung tiếng Việt trong Selflo được dịch, diễn đạt hoặc biên soạn lại trực tiếp từ các nguồn đã dẫn để truyền tải trung thành ý nghĩa gốc; không sao chép từ các bản dịch tiếng Việt hiện đại có bản quyền."
      },
      "review": {
        "status": "approved",
        "reviewed_by": "owner:dungvo",
        "reviewed_at": "2026-09-13T01:41:15Z"
      },
      "writing": {
        "semantic_intent": "Có nhiều điều làm ta sợ hơn là thật sự quật ngã ta; ta thường đau trong tưởng tượng nhiều hơn trong thực tế.",
        "observation_key": null,
        "structure_pattern": "attributed_quote"
      },
      "display": {
        "mode": "poster",
        "priority": 50,
        "featured": false,
        "style": "paper_quote",
        "attribution_vi": "Seneca · Thư gửi Lucilius · 13"
      },
      "story_id": null,
      "selection": {
        "source_type": "reflection",
        "reflection_kind": "quote",
        "thought_match_keys": [

        ],
        "presentation_tags": [
          "emotion",
          "stoicism",
          "future_fear"
        ],
        "tie_break_order": 5015
      },
      "knowledge_basis": null
    }
  ]
}
