{
  "schema_version": "1.0",
  "content_version": "framework-taxonomy-preview-15",
  "entity": "perspective_theme",
  "status": "approved",
  "primary_theme": "work_achievement",
  "display_name_vi": "Công việc và thành tựu",
  "description_vi": "Làm việc, sáng tạo, lãnh đạo, thành công và điều mình muốn tạo ra.",
  "language": "vi",
  "quotes": [
    {
      "id": "attributed.ma.iv_31.love_your_art",
      "revision": 2,
      "kind": "adapted_wisdom",
      "title_vi": null,
      "text_vi": "Hãy yêu nghề mình đã học, dù nghề ấy khiêm nhường, và tìm thấy niềm thư thái trong chính nó.",
      "subtitle_vi": null,
      "primary_theme": "work_achievement",
      "authorship": {
        "author_id": "marcus_aurelius",
        "author_name": "Marcus Aurelius",
        "work": "The Meditations of the Emperor Marcus Aurelius Antoninus",
        "source_url": "https://www.gutenberg.org/ebooks/55317",
        "source_language": "en",
        "source_label": "Marcus Aurelius · Suy tưởng",
        "source_detail": "George W. Chrystal (dịch), 1902; Quyển IV, đoạn 31; bản Việt là bản dịch nháp Selflo từ exact English source"
      },
      "metadata": {
        "concepts": [

        ],
        "theories": [

        ],
        "frameworks": [
          "framework.stoicism"
        ],
        "emotion_tags": [

        ],
        "keywords": [
          "craft"
        ]
      },
      "rights": {
        "status": "public_domain",
        "note": "Tác phẩm và bản dịch nguồn được sử dụng là các văn bản cổ hoặc các ấn bản thuộc phạm vi công cộng. Nội dung tiếng Việt trong Selflo được dịch, diễn đạt hoặc biên soạn lại trực tiếp từ các nguồn đã dẫn để truyền tải trung thành ý nghĩa gốc; không sao chép từ các bản dịch tiếng Việt hiện đại có bản quyền."
      },
      "review": {
        "status": "approved",
        "reviewed_by": "owner:dungvo",
        "reviewed_at": "2026-09-13T01:41:15Z"
      },
      "writing": {
        "semantic_intent": "Hãy yêu nghề mình đã học, dù nghề ấy khiêm nhường, và tìm thấy niềm thư thái trong chính nó.",
        "observation_key": null,
        "structure_pattern": "attributed_quote"
      },
      "display": {
        "mode": "poster",
        "priority": 50,
        "featured": false,
        "style": "cool_observe",
        "attribution_vi": "Marcus Aurelius · Suy tưởng · Quyển IV, đoạn 31"
      },
      "story_id": "story.photograph_missing_a_corner",
      "selection": {
        "source_type": "reflection",
        "reflection_kind": "quote",
        "thought_match_keys": [

        ],
        "presentation_tags": [
          "work_achievement",
          "craft"
        ],
        "tie_break_order": 1131
      },
      "knowledge_basis": null
    },
    {
      "id": "attributed.ma.viii_32.single_acts",
      "revision": 2,
      "kind": "adapted_wisdom",
      "title_vi": null,
      "text_vi": "Hãy sắp xếp đời mình bằng từng hành động riêng lẻ; nếu mỗi hành động hoàn thành được phần của nó trong khả năng có thể, như vậy là đủ. Trong việc ấy, không ai ngăn được bạn.",
      "subtitle_vi": null,
      "primary_theme": "work_achievement",
      "authorship": {
        "author_id": "marcus_aurelius",
        "author_name": "Marcus Aurelius",
        "work": "The Meditations of the Emperor Marcus Aurelius Antoninus",
        "source_url": "https://www.gutenberg.org/ebooks/55317",
        "source_language": "en",
        "source_label": "Marcus Aurelius · Suy tưởng",
        "source_detail": "George W. Chrystal (dịch), 1902; Quyển VIII, đoạn 32; bản Việt là bản dịch nháp Selflo từ exact English source"
      },
      "metadata": {
        "concepts": [

        ],
        "theories": [

        ],
        "frameworks": [
          "framework.stoicism"
        ],
        "emotion_tags": [

        ],
        "keywords": [
          "next_step"
        ]
      },
      "rights": {
        "status": "public_domain",
        "note": "Tác phẩm và bản dịch nguồn được sử dụng là các văn bản cổ hoặc các ấn bản thuộc phạm vi công cộng. Nội dung tiếng Việt trong Selflo được dịch, diễn đạt hoặc biên soạn lại trực tiếp từ các nguồn đã dẫn để truyền tải trung thành ý nghĩa gốc; không sao chép từ các bản dịch tiếng Việt hiện đại có bản quyền."
      },
      "review": {
        "status": "approved",
        "reviewed_by": "owner:dungvo",
        "reviewed_at": "2026-09-13T01:41:15Z"
      },
      "writing": {
        "semantic_intent": "Hãy sắp xếp đời mình bằng từng hành động riêng lẻ; nếu mỗi hành động hoàn thành được phần của nó trong khả năng có thể, như vậy là đủ. Trong việc ấy, không ai ngăn được bạn.",
        "observation_key": null,
        "structure_pattern": "attributed_quote"
      },
      "display": {
        "mode": "poster",
        "priority": 50,
        "featured": false,
        "style": "paper_quote",
        "attribution_vi": "Marcus Aurelius · Suy tưởng · Quyển VIII, đoạn 32"
      },
      "story_id": null,
      "selection": {
        "source_type": "reflection",
        "reflection_kind": "quote",
        "thought_match_keys": [

        ],
        "presentation_tags": [
          "work_achievement",
          "next_step"
        ],
        "tie_break_order": 1159
      },
      "knowledge_basis": null
    },
    {
      "id": "attributed.laozi.chapter_24.tiptoes",
      "revision": 2,
      "kind": "adapted_wisdom",
      "title_vi": null,
      "text_vi": "Người đứng nhón chân không thể đứng vững; người bước quá dài không thể đi dễ dàng.",
      "subtitle_vi": null,
      "primary_theme": "work_achievement",
      "authorship": {
        "author_id": "laozi",
        "author_name": "Laozi",
        "work": "The Tao Teh King, or the Tao and its Characteristics",
        "source_url": "https://www.gutenberg.org/ebooks/216",
        "source_language": "en",
        "source_label": "Lão Tử · Đạo Đức Kinh",
        "source_detail": "James Legge (dịch); 24; bản Việt là bản dịch nháp Selflo từ exact English source"
      },
      "metadata": {
        "concepts": [

        ],
        "theories": [

        ],
        "frameworks": [
          "framework.taoism"
        ],
        "emotion_tags": [

        ],
        "keywords": [
          "taoism",
          "sustainable_pace"
        ]
      },
      "rights": {
        "status": "public_domain",
        "note": "Tác phẩm và bản dịch nguồn được sử dụng là các văn bản cổ hoặc các ấn bản thuộc phạm vi công cộng. Nội dung tiếng Việt trong Selflo được dịch, diễn đạt hoặc biên soạn lại trực tiếp từ các nguồn đã dẫn để truyền tải trung thành ý nghĩa gốc; không sao chép từ các bản dịch tiếng Việt hiện đại có bản quyền."
      },
      "review": {
        "status": "approved",
        "reviewed_by": "owner:dungvo",
        "reviewed_at": "2026-09-13T01:41:15Z"
      },
      "writing": {
        "semantic_intent": "Người đứng nhón chân không thể đứng vững; người bước quá dài không thể đi dễ dàng.",
        "observation_key": null,
        "structure_pattern": "attributed_quote"
      },
      "display": {
        "mode": "poster",
        "priority": 50,
        "featured": false,
        "style": "paper_quote",
        "attribution_vi": "Lão Tử · Đạo Đức Kinh · 24"
      },
      "story_id": null,
      "selection": {
        "source_type": "reflection",
        "reflection_kind": "quote",
        "thought_match_keys": [

        ],
        "presentation_tags": [
          "work_achievement",
          "taoism",
          "sustainable_pace"
        ],
        "tie_break_order": 5026
      },
      "knowledge_basis": null
    },
    {
      "id": "attributed.confucius.book_i_ch01.learning",
      "revision": 2,
      "kind": "adapted_wisdom",
      "title_vi": null,
      "text_vi": "Học mà bền bỉ thực hành, chẳng phải là điều vui sao?",
      "subtitle_vi": null,
      "primary_theme": "work_achievement",
      "authorship": {
        "author_id": "confucius",
        "author_name": "Confucius",
        "work": "The Analects of Confucius (from the Chinese Classics)",
        "source_url": "https://www.gutenberg.org/ebooks/3330",
        "source_language": "en",
        "source_label": "Khổng Tử · Luận Ngữ",
        "source_detail": "James Legge (dịch); I.1; bản Việt là bản dịch nháp Selflo từ exact English source"
      },
      "metadata": {
        "concepts": [

        ],
        "theories": [

        ],
        "frameworks": [
          "framework.confucianism"
        ],
        "emotion_tags": [

        ],
        "keywords": [
          "confucianism",
          "learning"
        ]
      },
      "rights": {
        "status": "public_domain",
        "note": "Tác phẩm và bản dịch nguồn được sử dụng là các văn bản cổ hoặc các ấn bản thuộc phạm vi công cộng. Nội dung tiếng Việt trong Selflo được dịch, diễn đạt hoặc biên soạn lại trực tiếp từ các nguồn đã dẫn để truyền tải trung thành ý nghĩa gốc; không sao chép từ các bản dịch tiếng Việt hiện đại có bản quyền."
      },
      "review": {
        "status": "approved",
        "reviewed_by": "owner:dungvo",
        "reviewed_at": "2026-09-13T01:41:15Z"
      },
      "writing": {
        "semantic_intent": "Học mà bền bỉ thực hành, chẳng phải là điều vui sao?",
        "observation_key": null,
        "structure_pattern": "attributed_quote"
      },
      "display": {
        "mode": "poster",
        "priority": 50,
        "featured": false,
        "style": "paper_quote",
        "attribution_vi": "Khổng Tử · Luận Ngữ · I.1"
      },
      "story_id": null,
      "selection": {
        "source_type": "reflection",
        "reflection_kind": "quote",
        "thought_match_keys": [

        ],
        "presentation_tags": [
          "work_achievement",
          "confucianism",
          "learning"
        ],
        "tie_break_order": 5040
      },
      "knowledge_basis": null
    }
  ]
}
